{
  "$schema":"https://json-schema.org/draft/2020-12/schema","$id":"https://schemas.example.invalid/legal-chatbot/v1/evaluation.schema.json","title":"Evaluation exchanges","description":"Version-neutral additive LATER definitions only; candidates never activate or release production capability.","x-owner":"evaluation-service","$ref":"#/$defs/Dataset",
  "$defs":{"DatasetMember":{"type":"object","properties":{"golden_answer_id":{"$ref":"common.schema.json#/$defs/Id"},"split":{"type":"string","enum":["TRAIN","VALIDATION","TEST"]},"approval_snapshot_hash":{"$ref":"common.schema.json#/$defs/HashValue"},"citation_validation_id":{"$ref":"common.schema.json#/$defs/Id"}},"required":["golden_answer_id","split","approval_snapshot_hash","citation_validation_id"],"additionalProperties":false},"Dataset":{"type":"object","properties":{"dataset_id":{"$ref":"common.schema.json#/$defs/Id"},"revision":{"$ref":"common.schema.json#/$defs/Revision"},"status":{"type":"string","enum":["DRAFT","FROZEN","SUPERSEDED","REVOKED"]},"members":{"type":"array","items":{"$ref":"#/$defs/DatasetMember"}},"manifest_hash":{"$ref":"common.schema.json#/$defs/HashValue"},"frozen_at":{"$ref":"common.schema.json#/$defs/Timestamp"}},"required":["dataset_id","revision","status","members"],"additionalProperties":false,"allOf":[{"if":{"properties":{"status":{"const":"FROZEN"}},"required":["status"]},"then":{"properties":{"members":{"minItems":1}},"required":["manifest_hash","frozen_at"]}}]},"Metric":{"type":"object","properties":{"name":{"type":"string","minLength":1},"value":{"type":"number"}},"required":["name","value"],"additionalProperties":false},"Evaluation":{"type":"object","properties":{"evaluation_id":{"$ref":"common.schema.json#/$defs/Id"},"dataset_id":{"$ref":"common.schema.json#/$defs/Id"},"candidate_id":{"$ref":"common.schema.json#/$defs/Id"},"config_ref":{"$ref":"common.schema.json#/$defs/Id"},"evaluator_hash":{"$ref":"common.schema.json#/$defs/HashValue"},"config_hash":{"$ref":"common.schema.json#/$defs/HashValue"},"status":{"type":"string","enum":["QUEUED","RUNNING","COMPLETED","FAILED","CANCELLED"]},"created_at":{"$ref":"common.schema.json#/$defs/Timestamp"},"completed_at":{"$ref":"common.schema.json#/$defs/Timestamp"},"metrics":{"type":"array","items":{"$ref":"#/$defs/Metric"},"minItems":1},"result_hash":{"$ref":"common.schema.json#/$defs/HashValue"}},"required":["evaluation_id","dataset_id","candidate_id","config_ref","evaluator_hash","config_hash","status","created_at"],"additionalProperties":false,"allOf":[{"if":{"properties":{"status":{"const":"COMPLETED"}},"required":["status"]},"then":{"required":["completed_at","metrics","result_hash"]}}]},"Candidate":{"type":"object","properties":{"candidate_id":{"$ref":"common.schema.json#/$defs/Id"},"type":{"type":"string","enum":["PROMPT","RETRIEVAL_CONFIG","MODEL"]},"status":{"type":"string","enum":["DRAFT","EVALUATED","ELIGIBLE","REJECTED","WITHDRAWN"]},"artifact_hash":{"$ref":"common.schema.json#/$defs/HashValue"},"config_hash":{"$ref":"common.schema.json#/$defs/HashValue"},"evaluation_ids":{"type":"array","items":{"$ref":"common.schema.json#/$defs/Id"},"uniqueItems":true},"reason_codes":{"type":"array","items":{"$ref":"common.schema.json#/$defs/ReasonCode"},"uniqueItems":true}},"required":["candidate_id","type","status","artifact_hash","config_hash","evaluation_ids"],"additionalProperties":false}}
}
